{
  "$schema": "https://json-schema.org/draft/2020-12/schema",
  "$id": "urn:speculo:specdev:config:v5",
  "title": "SpecDev Configuration",
  "type": "object",
  "required": ["schema_version", "interaction_language", "artifact_language", "git", "execution", "verification", "planning"],
  "properties": {
    "schema_version": {"const": 5},
    "interaction_language": {"type": "string", "minLength": 1},
    "artifact_language": {"type": "string", "minLength": 1},
    "git": {
      "type": "object",
      "required": ["default_branch"],
      "properties": {
        "default_branch": {"type": ["string", "null"]}
      },
      "additionalProperties": false
    },
    "execution": {
      "type": "object",
      "required": ["max_implementation_agents", "max_integration_attempts", "deep_ticket_human_approval", "shared_path_owner"],
      "properties": {
        "max_implementation_agents": {"type": "integer", "minimum": 1},
        "max_integration_attempts": {
          "anyOf": [
            {"type": "integer", "minimum": 1},
            {"type": "null"}
          ]
        },
        "deep_ticket_human_approval": {"type": "boolean"},
        "shared_path_owner": {"type": "string", "minLength": 1}
      },
      "additionalProperties": false
    },
    "verification": {
      "type": "object",
      "required": ["test", "typecheck", "lint", "build"],
      "properties": {
        "test": {"type": ["string", "null"]},
        "typecheck": {"type": ["string", "null"]},
        "lint": {"type": ["string", "null"]},
        "build": {"type": ["string", "null"]}
      },
      "additionalProperties": true
    },
    "planning": {
      "type": "object",
      "required": ["default_depth", "require_ready_gate", "require_evidence", "ui_prototype_default_variants", "ui_prototype_max_variants"],
      "properties": {
        "default_depth": {"enum": ["lite", "standard", "deep"]},
        "require_ready_gate": {"type": "boolean"},
        "require_evidence": {"type": "boolean"},
        "ui_prototype_default_variants": {"type": "integer", "minimum": 1},
        "ui_prototype_max_variants": {"type": "integer", "minimum": 1}
      },
      "additionalProperties": true
    }
  },
  "allOf": [{
    "$comment": "ui_prototype_default_variants <= ui_prototype_max_variants is enforced by validate-specdev.mjs because JSON Schema cannot compare sibling numeric values."
  }],
  "additionalProperties": false
}
